[
  {
    "event_id": "m017-e0001",
    "match_id": "m017",
    "t": 0.0,
    "period": 1,
    "clock": "0:00",
    "type": "period_start",
    "qualifiers": {}
  },
  {
    "event_id": "m017-e0002",
    "match_id": "m017",
    "t": 0.0,
    "period": 1,
    "clock": "0:00",
    "type": "kick_off",
    "team_id": "ash",
    "player_id": "ash-09",
    "start": [
      52.5,
      34.0
    ],
    "end": [
      46.0,
      30.0
    ],
    "outcome": "complete",
    "receiver_id": "ash-08",
    "qualifiers": {
      "distance_m": 7.6
    },
    "possession_id": "m017-p001"
  },
  {
    "event_id": "m017-e0003",
    "match_id": "m017",
    "t": 1.6,
    "period": 1,
    "clock": "0:01",
    "type": "pass",
    "team_id": "ash",
    "player_id": "ash-08",
    "start": [
      46.0,
      30.0
    ],
    "end": [
      24.0,
      26.0
    ],
    "outcome": "complete",
    "receiver_id": "ash-04",
    "qualifiers": {
      "distance_m": 22.4
    },
    "possession_id": "m017-p001"
  },
  {
    "event_id": "m017-e0004",
    "match_id": "m017",
    "t": 4.4,
    "period": 1,
    "clock": "0:04",
    "type": "pass",
    "team_id": "ash",
    "player_id": "ash-04",
    "start": [
      24.0,
      26.0
    ],
    "end": [
      31.0,
      9.0
    ],
    "outcome": "complete",
    "receiver_id": "ash-02",
    "qualifiers": {
      "distance_m": 18.4
    },
    "possession_id": "m017-p001"
  },
  {
    "event_id": "m017-e0005",
    "match_id": "m017",
    "t": 6.0,
    "period": 1,
    "clock": "0:06",
    "type": "carry",
    "team_id": "ash",
    "player_id": "ash-02",
    "start": [
      31.0,
      9.0
    ],
    "end": [
      39.0,
      8.0
    ],
    "qualifiers": {
      "distance_m": 8.1,
      "duration_s": 2.2
    },
    "possession_id": "m017-p001"
  },
  {
    "event_id": "m017-e0006",
    "match_id": "m017",
    "t": 8.6,
    "period": 1,
    "clock": "0:08",
    "type": "pass",
    "team_id": "ash",
    "player_id": "ash-02",
    "start": [
      39.0,
      8.0
    ],
    "end": [
      54.0,
      6.0
    ],
    "outcome": "complete",
    "receiver_id": "ash-07",
    "qualifiers": {
      "distance_m": 15.1
    },
    "possession_id": "m017-p001"
  },
  {
    "event_id": "m017-e0007",
    "match_id": "m017",
    "t": 10.0,
    "period": 1,
    "clock": "0:10",
    "type": "pressure",
    "team_id": "brk",
    "player_id": "brk-03",
    "start": [
      51.0,
      62.0
    ],
    "outcome": "won",
    "related_player_id": "ash-07",
    "qualifiers": {},
    "possession_id": "m017-p001"
  },
  {
    "event_id": "m017-e0008",
    "match_id": "m017",
    "t": 10.6,
    "period": 1,
    "clock": "0:10",
    "type": "tackle",
    "team_id": "brk",
    "player_id": "brk-03",
    "start": [
      50.5,
      62.0
    ],
    "outcome": "won",
    "related_player_id": "ash-07",
    "qualifiers": {},
    "possession_id": "m017-p002"
  },
  {
    "event_id": "m017-e0009",
    "match_id": "m017",
    "t": 11.4,
    "period": 1,
    "clock": "0:11",
    "type": "pass",
    "team_id": "brk",
    "player_id": "brk-03",
    "start": [
      50.5,
      61.5
    ],
    "end": [
      45.0,
      43.0
    ],
    "outcome": "complete",
    "receiver_id": "brk-06",
    "qualifiers": {
      "distance_m": 19.3
    },
    "possession_id": "m017-p002"
  },
  {
    "event_id": "m017-e0010",
    "match_id": "m017",
    "t": 13.4,
    "period": 1,
    "clock": "0:13",
    "type": "pass",
    "team_id": "brk",
    "player_id": "brk-06",
    "start": [
      45.0,
      43.0
    ],
    "end": [
      59.0,
      37.0
    ],
    "outcome": "complete",
    "receiver_id": "brk-10",
    "qualifiers": {
      "distance_m": 15.2
    },
    "possession_id": "m017-p002"
  },
  {
    "event_id": "m017-e0011",
    "match_id": "m017",
    "t": 14.8,
    "period": 1,
    "clock": "0:14",
    "type": "carry",
    "team_id": "brk",
    "player_id": "brk-10",
    "start": [
      59.0,
      37.0
    ],
    "end": [
      68.0,
      31.0
    ],
    "qualifiers": {
      "distance_m": 10.8,
      "duration_s": 2.2
    },
    "possession_id": "m017-p002"
  },
  {
    "event_id": "m017-e0012",
    "match_id": "m017",
    "t": 17.2,
    "period": 1,
    "clock": "0:17",
    "type": "pass",
    "team_id": "brk",
    "player_id": "brk-10",
    "start": [
      68.0,
      31.0
    ],
    "end": [
      77.0,
      54.0
    ],
    "outcome": "complete",
    "receiver_id": "brk-11",
    "qualifiers": {
      "distance_m": 24.7
    },
    "possession_id": "m017-p002"
  },
  {
    "event_id": "m017-e0013",
    "match_id": "m017",
    "t": 18.7,
    "period": 1,
    "clock": "0:18",
    "type": "carry",
    "team_id": "brk",
    "player_id": "brk-11",
    "start": [
      77.0,
      54.0
    ],
    "end": [
      86.0,
      57.0
    ],
    "qualifiers": {
      "distance_m": 9.5,
      "duration_s": 1.5
    },
    "possession_id": "m017-p002"
  },
  {
    "event_id": "m017-e0014",
    "match_id": "m017",
    "t": 20.3,
    "period": 1,
    "clock": "0:20",
    "type": "pass",
    "team_id": "brk",
    "player_id": "brk-11",
    "start": [
      86.0,
      57.0
    ],
    "end": [
      96.0,
      33.0
    ],
    "outcome": "complete",
    "receiver_id": "brk-09",
    "qualifiers": {
      "distance_m": 26.0,
      "pass_type": "cross"
    },
    "possession_id": "m017-p002"
  },
  {
    "event_id": "m017-e0015",
    "match_id": "m017",
    "t": 21.6,
    "period": 1,
    "clock": "0:21",
    "type": "shot",
    "team_id": "brk",
    "player_id": "brk-09",
    "start": [
      96.0,
      33.0
    ],
    "end": [
      105.0,
      30.0
    ],
    "outcome": "blocked",
    "qualifiers": {
      "xg": 0.18,
      "shot_speed_kmh": 54.0,
      "body_part": "head"
    },
    "possession_id": "m017-p002"
  },
  {
    "event_id": "m017-e0016",
    "match_id": "m017",
    "t": 36.0,
    "period": 1,
    "clock": "0:36",
    "type": "corner",
    "team_id": "brk",
    "player_id": "brk-07",
    "start": [
      104.6,
      0.4
    ],
    "end": [
      97.0,
      37.0
    ],
    "outcome": "complete",
    "receiver_id": "brk-05",
    "qualifiers": {
      "distance_m": 37.4,
      "pass_type": "lofted"
    },
    "possession_id": "m017-p002"
  },
  {
    "event_id": "m017-e0017",
    "match_id": "m017",
    "t": 37.5,
    "period": 1,
    "clock": "0:37",
    "type": "shot",
    "team_id": "brk",
    "player_id": "brk-05",
    "start": [
      97.0,
      37.0
    ],
    "end": [
      105.5,
      36.5
    ],
    "outcome": "off_target",
    "qualifiers": {
      "xg": 0.09,
      "shot_speed_kmh": 48.0,
      "body_part": "head",
      "end_height_m": 3.1
    },
    "possession_id": "m017-p002"
  },
  {
    "event_id": "m017-e0018",
    "match_id": "m017",
    "t": 48.0,
    "period": 1,
    "clock": "0:48",
    "type": "goal_kick",
    "team_id": "ash",
    "player_id": "ash-01",
    "start": [
      6.0,
      30.0
    ],
    "end": [
      20.0,
      21.0
    ],
    "outcome": "complete",
    "receiver_id": "ash-05",
    "qualifiers": {
      "distance_m": 16.6
    },
    "possession_id": "m017-p003"
  },
  {
    "event_id": "m017-e0019",
    "match_id": "m017",
    "t": 50.4,
    "period": 1,
    "clock": "0:50",
    "type": "pass",
    "team_id": "ash",
    "player_id": "ash-05",
    "start": [
      20.0,
      21.0
    ],
    "end": [
      31.0,
      29.0
    ],
    "outcome": "complete",
    "receiver_id": "ash-06",
    "qualifiers": {
      "distance_m": 13.6
    },
    "possession_id": "m017-p003"
  },
  {
    "event_id": "m017-e0020",
    "match_id": "m017",
    "t": 51.6,
    "period": 1,
    "clock": "0:51",
    "type": "carry",
    "team_id": "ash",
    "player_id": "ash-06",
    "start": [
      31.0,
      29.0
    ],
    "end": [
      37.0,
      31.0
    ],
    "qualifiers": {
      "distance_m": 6.3,
      "duration_s": 1.8
    },
    "possession_id": "m017-p003"
  },
  {
    "event_id": "m017-e0021",
    "match_id": "m017",
    "t": 53.4,
    "period": 1,
    "clock": "0:53",
    "type": "pass",
    "team_id": "ash",
    "player_id": "ash-06",
    "start": [
      37.0,
      31.0
    ],
    "end": [
      49.0,
      39.0
    ],
    "outcome": "complete",
    "receiver_id": "ash-08",
    "qualifiers": {
      "distance_m": 14.4
    },
    "possession_id": "m017-p003"
  },
  {
    "event_id": "m017-e0022",
    "match_id": "m017",
    "t": 54.6,
    "period": 1,
    "clock": "0:54",
    "type": "pressure",
    "team_id": "brk",
    "player_id": "brk-06",
    "start": [
      57.0,
      30.0
    ],
    "outcome": "lost",
    "related_player_id": "ash-08",
    "qualifiers": {},
    "possession_id": "m017-p003"
  },
  {
    "event_id": "m017-e0023",
    "match_id": "m017",
    "t": 54.7,
    "period": 1,
    "clock": "0:54",
    "type": "carry",
    "team_id": "ash",
    "player_id": "ash-08",
    "start": [
      49.0,
      39.0
    ],
    "end": [
      56.0,
      37.0
    ],
    "qualifiers": {
      "distance_m": 7.3,
      "duration_s": 1.3
    },
    "possession_id": "m017-p003"
  },
  {
    "event_id": "m017-e0024",
    "match_id": "m017",
    "t": 56.0,
    "period": 1,
    "clock": "0:56",
    "type": "pass",
    "team_id": "ash",
    "player_id": "ash-08",
    "start": [
      56.0,
      37.0
    ],
    "end": [
      80.0,
      29.0
    ],
    "outcome": "complete",
    "receiver_id": "ash-09",
    "qualifiers": {
      "distance_m": 25.3,
      "difficulty": 0.71,
      "pressure_on_passer": 0.4,
      "line_breaking": true,
      "pass_type": "through",
      "ball_speed_kmh": 58.0
    },
    "possession_id": "m017-p003"
  },
  {
    "event_id": "m017-e0025",
    "match_id": "m017",
    "t": 57.6,
    "period": 1,
    "clock": "0:57",
    "type": "carry",
    "team_id": "ash",
    "player_id": "ash-09",
    "start": [
      80.0,
      29.0
    ],
    "end": [
      92.0,
      32.0
    ],
    "qualifiers": {
      "distance_m": 12.4,
      "duration_s": 1.4
    },
    "possession_id": "m017-p003"
  },
  {